{"schemaVersion":"1.0.0","variant":{"id":"chr12-54584902-C-T","chromosome":"chr12","position":54584902,"ref":"C","alt":"T","rsid":"rs7954532","gene":"PPP1R1A"},"provenance":{"source":"synthetic","clientVersion":"0.9.0","pipelineVersion":"0.1.0","queriedAt":"2026-09-11T10:30:49Z","configHash":"eb8393582d3d94b8","calibrationEpoch":"quantiles>=2026-06-18,indels>=2026-07-14","notes":"Fixture sintetica, semilla 54584902. NO son predicciones."},"avi":{"phred":6.799,"quantile":0.791027,"baseValue":6.0},"featureFamilies":[{"id":"regulatory","label":"Regulatorio (AlphaGenome)","expectedCount":10},{"id":"protein","label":"Proteina","expectedCount":4},{"id":"conservation","label":"Conservacion","expectedCount":2},{"id":"indel","label":"Indel","expectedCount":2}],"features":[{"id":"splicing_fused","label":"Splicing (fusionado)","family":"regulatory","contribution":0.6439,"value":1.9133},{"id":"atac","label":"ATAC","family":"regulatory","contribution":1.1949,"value":-0.284},{"id":"dnase","label":"DNase","family":"regulatory","contribution":-0.4279,"value":-1.6669},{"id":"chip_tf","label":"ChIP-TF","family":"regulatory","contribution":0.2883,"value":-0.137},{"id":"chip_histone","label":"ChIP-histonas","family":"regulatory","contribution":0.2014,"value":0.0374},{"id":"cage","label":"CAGE","family":"regulatory","contribution":-0.9195,"value":1.2016},{"id":"procap","label":"PRO-cap","family":"regulatory","contribution":-0.4,"value":-0.5028},{"id":"rna_seq","label":"RNA-seq","family":"regulatory","contribution":1.3799,"value":1.1114},{"id":"polyadenylation","label":"Poliadenilacion","family":"regulatory","contribution":-0.0382,"value":0.2032},{"id":"contact_maps","label":"Mapas de contacto","family":"regulatory","contribution":-0.3182,"value":-0.8945},{"id":"alphamissense","label":"AlphaMissense","family":"protein","contribution":-0.0324,"value":0.1278},{"id":"stop_gained","label":"Stop ganado (VEP)","family":"protein","contribution":0.0448,"value":-0.5576},{"id":"stop_lost","label":"Stop perdido (VEP)","family":"protein","contribution":-0.0808,"value":1.3449},{"id":"start_lost","label":"Inicio perdido (VEP)","family":"protein","contribution":-0.2227,"value":-0.2424},{"id":"phylop","label":"phyloP Cactus 241-way","family":"conservation","contribution":-1.0338,"value":-0.3515},{"id":"phastcons","label":"PhastCons 470-way","family":"conservation","contribution":0.5194,"value":-1.6003},{"id":"is_insertion","label":"Es insercion","family":"indel","contribution":0.0,"value":0.0},{"id":"is_deletion","label":"Es delecion","family":"indel","contribution":0.0,"value":0.0}],"topTracks":[{"name":"SPLICE_SITE_USAGE:Ventriculo izquierdo","modality":"SPLICE_SITE_USAGE","biosample":"Ventriculo izquierdo","ontologyCurie":"UBERON:0006566","strand":".","score":-2.6951,"quantile":0.6061},{"name":"SPLICE_SITES:Ovario","modality":"SPLICE_SITES","biosample":"Ovario","ontologyCurie":"UBERON:0000992","strand":".","score":2.607,"quantile":0.602},{"name":"CHIP_HISTONE:Hipocampo","modality":"CHIP_HISTONE","biosample":"Hipocampo","ontologyCurie":"UBERON:0002421","strand":".","score":2.1379,"quantile":0.8904},{"name":"CONTACT_MAPS:Nervio tibial","modality":"CONTACT_MAPS","biosample":"Nervio tibial","ontologyCurie":"UBERON:0001323","strand":".","score":2.1129,"quantile":0.8059},{"name":"ATAC:Arteria coronaria","modality":"ATAC","biosample":"Arteria coronaria","ontologyCurie":"UBERON:0001621","strand":".","score":2.0823,"quantile":0.9606},{"name":"CAGE:Rinon cortex","modality":"CAGE","biosample":"Rinon cortex","ontologyCurie":"UBERON:0001225","strand":".","score":1.835,"quantile":0.7721},{"name":"RNA_SEQ:K562","modality":"RNA_SEQ","biosample":"K562","ontologyCurie":"UBERON:0000178","strand":".","score":1.3044,"quantile":0.9511},{"name":"RNA_SEQ:Pancreas","modality":"RNA_SEQ","biosample":"Pancreas","ontologyCurie":"UBERON:0001264","strand":".","score":-1.2527,"quantile":0.8251},{"name":"CAGE:Colon transverso","modality":"CAGE","biosample":"Colon transverso","ontologyCurie":"UBERON:0001157","strand":".","score":1.167,"quantile":0.5101},{"name":"PROCAP:Auricula derecha","modality":"PROCAP","biosample":"Auricula derecha","ontologyCurie":"UBERON:0002078","strand":".","score":1.1381,"quantile":0.632},{"name":"POLYADENYLATION:Bazo","modality":"POLYADENYLATION","biosample":"Bazo","ontologyCurie":"UBERON:0002106","strand":".","score":-1.1225,"quantile":0.8312},{"name":"SPLICE_SITES:HepG2","modality":"SPLICE_SITES","biosample":"HepG2","ontologyCurie":"UBERON:0002107","strand":".","score":0.7756,"quantile":0.9469},{"name":"PROCAP:Placenta","modality":"PROCAP","biosample":"Placenta","ontologyCurie":"UBERON:0001987","strand":".","score":-0.5727,"quantile":0.8314},{"name":"CHIP_TF:Monocito","modality":"CHIP_TF","biosample":"Monocito","ontologyCurie":"CL:0000576","strand":".","score":-0.4551,"quantile":0.5893},{"name":"SPLICE_SITE_USAGE:CD4+ T","modality":"SPLICE_SITE_USAGE","biosample":"CD4+ T","ontologyCurie":"CL:0000624","strand":".","score":0.3008,"quantile":0.6621},{"name":"CHIP_TF:A549","modality":"CHIP_TF","biosample":"A549","ontologyCurie":"UBERON:0002048","strand":".","score":-0.2885,"quantile":0.9953},{"name":"DNASE:Cerebelo","modality":"DNASE","biosample":"Cerebelo","ontologyCurie":"UBERON:0002037","strand":".","score":-0.1853,"quantile":0.9823},{"name":"CHIP_HISTONE:Fibroblasto dermico","modality":"CHIP_HISTONE","biosample":"Fibroblasto dermico","ontologyCurie":"CL:0002620","strand":".","score":-0.1254,"quantile":0.7485},{"name":"ATAC:Celula NK","modality":"ATAC","biosample":"Celula NK","ontologyCurie":"CL:0000623","strand":".","score":-0.0738,"quantile":0.6128},{"name":"DNASE:Suprarrenal","modality":"DNASE","biosample":"Suprarrenal","ontologyCurie":"UBERON:0002369","strand":".","score":-0.0502,"quantile":0.8996}]}