{"schemaVersion":"1.1.0","variant":{"id":"chr12-54578515-C-T","chromosome":"chr12","position":54578515,"ref":"C","alt":"T","rsid":"rs884510","gene":"PPP1R1A"},"provenance":{"source":"atlas-api","clientVersion":"0.9.0","pipelineVersion":"0.1.0","queriedAt":"2026-09-11T12:34:58Z","configHash":"8e43489c33743b7e","calibrationEpoch":"quantiles>=2026-06-18,indels>=2026-07-14","scorers":["AVI_SCORE","AVI_SCORE_FEATURE_IMPORTANCE","AVI_SCORE_MODEL_FEATURES","RNA_SEQ","ATAC","DNASE","CAGE","PROCAP","CHIP_TF","CHIP_HISTONE","SPLICE_SITE_USAGE","SPLICE_JUNCTIONS","POLYADENYLATION","CONTACT_MAPS"],"hasQuantiles":true},"avi":{"phred":0.2545,"quantile":0.05691886,"baseValue":-0.049029,"rawScore":-0.10092},"featureFamilies":[{"id":"regulatory","label":"Regulatorio (AlphaGenome)","expectedCount":10},{"id":"protein","label":"Proteina","expectedCount":4},{"id":"conservation","label":"Conservacion","expectedCount":2},{"id":"indel","label":"Indel","expectedCount":2}],"features":[{"id":"MERGED_SPLICING","label":"Splicing (fusionado)","family":"regulatory","contribution":0.068995,"value":0.232812},{"id":"MAX_ABS_ATAC","label":"ATAC","family":"regulatory","contribution":0.002912,"value":0.043255},{"id":"MAX_ABS_CONTACT_MAPS","label":"Mapas de contacto","family":"regulatory","contribution":0.001252,"value":0.001111},{"id":"MAX_ABS_DNASE","label":"DNase","family":"regulatory","contribution":0.003591,"value":0.046557},{"id":"MAX_ABS_CHIP_TF","label":"ChIP-TF","family":"regulatory","contribution":0.000364,"value":0.059936},{"id":"MAX_ABS_CHIP_HISTONE","label":"ChIP-histonas","family":"regulatory","contribution":0.002796,"value":0.030694},{"id":"MAX_ABS_CAGE","label":"CAGE","family":"regulatory","contribution":0.00142,"value":0.029962},{"id":"MAX_ABS_PROCAP","label":"PRO-cap","family":"regulatory","contribution":0.003193,"value":0.038696},{"id":"MAX_ABS_RNA_SEQ","label":"RNA-seq","family":"regulatory","contribution":0.001767,"value":0.018379},{"id":"MAX_ABS_POLYADENYLATION","label":"Poliadenilacion","family":"regulatory","contribution":0.003742,"value":0.037886},{"id":"ALPHAMISSENSE","label":"AlphaMissense","family":"protein","contribution":0.0,"value":null},{"id":"CACTUS_241_WAY","label":"phyloP Cactus 241-way","family":"conservation","contribution":-0.141924,"value":-2.305},{"id":"PROTEIN_TERMINATION","label":"Terminacion de proteina","family":"protein","contribution":0.0,"value":0.0},{"id":"START_LOST","label":"Inicio perdido","family":"protein","contribution":0.0,"value":0.0},{"id":"STOP_LOST","label":"Stop perdido","family":"protein","contribution":0.0,"value":0.0},{"id":"PHASTCONS_470_WAY","label":"PhastCons 470-way","family":"conservation","contribution":0.0,"value":0.0},{"id":"IS_INSERTION","label":"Es insercion","family":"indel","contribution":0.0,"value":0.0},{"id":"IS_DELETION","label":"Es delecion","family":"indel","contribution":0.0,"value":0.0}],"topTracks":[{"name":"SPLICE_JUNCTIONS:Ammon's horn","modality":"SPLICE_JUNCTIONS","biosample":"Ammon's horn","ontologyCurie":"UBERON:0001954","strand":".","score":0.55859,"quantile":null},{"name":"SPLICE_JUNCTIONS:caudate nucleus","modality":"SPLICE_JUNCTIONS","biosample":"caudate nucleus","ontologyCurie":"UBERON:0001873","strand":".","score":0.55762,"quantile":null},{"name":"SPLICE_JUNCTIONS:nucleus accumbens","modality":"SPLICE_JUNCTIONS","biosample":"nucleus accumbens","ontologyCurie":"UBERON:0001882","strand":".","score":0.55713,"quantile":null},{"name":"CHIP_TF:HEK293","modality":"CHIP_TF","biosample":"HEK293","ontologyCurie":"EFO:0001182","strand":".","score":-0.05994,"quantile":null},{"name":"DNASE:H7","modality":"DNASE","biosample":"H7","ontologyCurie":"EFO:0005904","strand":".","score":-0.04656,"quantile":null},{"name":"DNASE:ELF-1","modality":"DNASE","biosample":"ELF-1","ontologyCurie":"EFO:0005901","strand":".","score":-0.04466,"quantile":null},{"name":"DNASE:mesendoderm","modality":"DNASE","biosample":"mesendoderm","ontologyCurie":"NTR:0000856","strand":".","score":-0.04364,"quantile":null},{"name":"ATAC:GM23338","modality":"ATAC","biosample":"GM23338","ontologyCurie":"EFO:0007950","strand":".","score":-0.04326,"quantile":null},{"name":"CHIP_TF:HepG2","modality":"CHIP_TF","biosample":"HepG2","ontologyCurie":"EFO:0001187","strand":".","score":-0.04302,"quantile":null},{"name":"ATAC:WTC11","modality":"ATAC","biosample":"WTC11","ontologyCurie":"EFO:0009747","strand":".","score":-0.0406,"quantile":null},{"name":"CHIP_TF:WTC11","modality":"CHIP_TF","biosample":"WTC11","ontologyCurie":"EFO:0009747","strand":".","score":-0.03968,"quantile":null},{"name":"PROCAP:A673","modality":"PROCAP","biosample":"A673","ontologyCurie":"EFO:0002106","strand":".","score":0.0387,"quantile":null},{"name":"POLYADENYLATION:HepG2","modality":"POLYADENYLATION","biosample":"HepG2","ontologyCurie":"EFO:0001187","strand":".","score":0.03388,"quantile":null},{"name":"CHIP_HISTONE:iPS-18a","modality":"CHIP_HISTONE","biosample":"iPS-18a","ontologyCurie":"EFO:0007105","strand":".","score":-0.03069,"quantile":null},{"name":"CAGE:epididymis","modality":"CAGE","biosample":"epididymis","ontologyCurie":"UBERON:0001301","strand":".","score":-0.02996,"quantile":null},{"name":"POLYADENYLATION:LHCN-M2","modality":"POLYADENYLATION","biosample":"LHCN-M2","ontologyCurie":"EFO:0005714","strand":".","score":0.02976,"quantile":null},{"name":"ATAC:HepG2","modality":"ATAC","biosample":"HepG2","ontologyCurie":"EFO:0001187","strand":".","score":-0.02955,"quantile":null},{"name":"CHIP_HISTONE:ectodermal cell","modality":"CHIP_HISTONE","biosample":"ectodermal cell","ontologyCurie":"CL:0000221","strand":".","score":-0.02953,"quantile":null},{"name":"CHIP_HISTONE:iPS-15b","modality":"CHIP_HISTONE","biosample":"iPS-15b","ontologyCurie":"EFO:0007102","strand":".","score":-0.02882,"quantile":null},{"name":"POLYADENYLATION:myocyte","modality":"POLYADENYLATION","biosample":"myocyte","ontologyCurie":"CL:0000187","strand":".","score":0.02752,"quantile":null}]}