{"schemaVersion":"1.1.0","variant":{"id":"chr17-44001600-C-A","chromosome":"chr17","position":44001600,"ref":"C","alt":"A","rsid":null,"gene":"NAGS"},"provenance":{"source":"atlas-api","clientVersion":"0.9.0","pipelineVersion":"0.1.0","queriedAt":"2026-09-12T19:29:57Z","configHash":"9826f0d58a56e355","calibrationEpoch":"quantiles>=2026-06-18,indels>=2026-07-14","scorers":["AVI_SCORE","AVI_SCORE_FEATURE_IMPORTANCE","AVI_SCORE_MODEL_FEATURES","RNA_SEQ","ATAC","DNASE","CAGE","PROCAP","CHIP_TF","CHIP_HISTONE","SPLICE_SITE_USAGE","SPLICE_JUNCTIONS","POLYADENYLATION","CONTACT_MAPS"],"hasQuantiles":true},"avi":{"phred":35.2402,"quantile":0.99970078,"baseValue":-0.06026,"rawScore":2.049265},"featureFamilies":[{"id":"regulatory","label":"Regulatorio (AlphaGenome)","expectedCount":10},{"id":"protein","label":"Proteina","expectedCount":4},{"id":"conservation","label":"Conservacion","expectedCount":2},{"id":"indel","label":"Indel","expectedCount":2}],"features":[{"id":"MERGED_SPLICING","label":"Splicing (fusionado)","family":"regulatory","contribution":0.137895,"value":0.395605},{"id":"MAX_ABS_ATAC","label":"ATAC","family":"regulatory","contribution":0.115814,"value":3.428843},{"id":"MAX_ABS_CONTACT_MAPS","label":"Mapas de contacto","family":"regulatory","contribution":0.01647,"value":0.016898},{"id":"MAX_ABS_DNASE","label":"DNase","family":"regulatory","contribution":0.057974,"value":3.860851},{"id":"MAX_ABS_CHIP_TF","label":"ChIP-TF","family":"regulatory","contribution":-0.029532,"value":3.813943},{"id":"MAX_ABS_CHIP_HISTONE","label":"ChIP-histonas","family":"regulatory","contribution":0.147079,"value":3.225672},{"id":"MAX_ABS_CAGE","label":"CAGE","family":"regulatory","contribution":0.296402,"value":6.537968},{"id":"MAX_ABS_PROCAP","label":"PRO-cap","family":"regulatory","contribution":0.347223,"value":5.662059},{"id":"MAX_ABS_RNA_SEQ","label":"RNA-seq","family":"regulatory","contribution":0.267736,"value":2.210896},{"id":"MAX_ABS_POLYADENYLATION","label":"Poliadenilacion","family":"regulatory","contribution":0.0,"value":0.0},{"id":"ALPHAMISSENSE","label":"AlphaMissense","family":"protein","contribution":0.0,"value":null},{"id":"CACTUS_241_WAY","label":"phyloP Cactus 241-way","family":"conservation","contribution":0.569798,"value":8.7},{"id":"PROTEIN_TERMINATION","label":"Terminacion de proteina","family":"protein","contribution":0.0,"value":0.0},{"id":"START_LOST","label":"Inicio perdido","family":"protein","contribution":0.0,"value":0.0},{"id":"STOP_LOST","label":"Stop perdido","family":"protein","contribution":0.0,"value":0.0},{"id":"PHASTCONS_470_WAY","label":"PhastCons 470-way","family":"conservation","contribution":0.182665,"value":1.0},{"id":"IS_INSERTION","label":"Es insercion","family":"indel","contribution":0.0,"value":0.0},{"id":"IS_DELETION","label":"Es delecion","family":"indel","contribution":0.0,"value":0.0}],"topTracks":[{"name":"CAGE:HepG2","modality":"CAGE","biosample":"HepG2","ontologyCurie":"EFO:0001187","strand":".","score":-6.53797,"quantile":null},{"name":"CAGE:liver","modality":"CAGE","biosample":"liver","ontologyCurie":"UBERON:0002107","strand":".","score":-6.53358,"quantile":null},{"name":"PROCAP:Caco-2","modality":"PROCAP","biosample":"Caco-2","ontologyCurie":"EFO:0001099","strand":".","score":-5.66206,"quantile":null},{"name":"CAGE:hepatocyte","modality":"CAGE","biosample":"hepatocyte","ontologyCurie":"CL:0000182","strand":".","score":-5.29019,"quantile":null},{"name":"DNASE:HepG2","modality":"DNASE","biosample":"HepG2","ontologyCurie":"EFO:0001187","strand":".","score":-3.86085,"quantile":null},{"name":"CHIP_TF:HepG2","modality":"CHIP_TF","biosample":"HepG2","ontologyCurie":"EFO:0001187","strand":".","score":-3.81394,"quantile":null},{"name":"CHIP_TF:liver","modality":"CHIP_TF","biosample":"liver","ontologyCurie":"UBERON:0002107","strand":".","score":-3.60675,"quantile":null},{"name":"ATAC:right lobe of liver","modality":"ATAC","biosample":"right lobe of liver","ontologyCurie":"UBERON:0001114","strand":".","score":-3.42884,"quantile":null},{"name":"PROCAP:Calu3","modality":"PROCAP","biosample":"Calu3","ontologyCurie":"EFO:0002819","strand":".","score":-3.42567,"quantile":null},{"name":"ATAC:left lobe of liver","modality":"ATAC","biosample":"left lobe of liver","ontologyCurie":"UBERON:0001115","strand":".","score":-3.38514,"quantile":null},{"name":"CHIP_HISTONE:HepG2","modality":"CHIP_HISTONE","biosample":"HepG2","ontologyCurie":"EFO:0001187","strand":".","score":-3.22567,"quantile":null},{"name":"DNASE:large intestine","modality":"DNASE","biosample":"large intestine","ontologyCurie":"UBERON:0000059","strand":".","score":-3.21772,"quantile":null},{"name":"CHIP_HISTONE:large intestine","modality":"CHIP_HISTONE","biosample":"large intestine","ontologyCurie":"UBERON:0000059","strand":".","score":-3.1099,"quantile":null},{"name":"DNASE:left lobe of liver","modality":"DNASE","biosample":"left lobe of liver","ontologyCurie":"UBERON:0001115","strand":".","score":-3.02684,"quantile":null},{"name":"ATAC:HepG2","modality":"ATAC","biosample":"HepG2","ontologyCurie":"EFO:0001187","strand":".","score":-2.83899,"quantile":null},{"name":"CHIP_HISTONE:liver","modality":"CHIP_HISTONE","biosample":"liver","ontologyCurie":"UBERON:0002107","strand":".","score":-2.77612,"quantile":null},{"name":"CHIP_TF:right lobe of liver","modality":"CHIP_TF","biosample":"right lobe of liver","ontologyCurie":"UBERON:0001114","strand":".","score":-2.01351,"quantile":null},{"name":"PROCAP:K562","modality":"PROCAP","biosample":"K562","ontologyCurie":"EFO:0002067","strand":".","score":-1.78471,"quantile":null},{"name":"SPLICE_JUNCTIONS:liver","modality":"SPLICE_JUNCTIONS","biosample":"liver","ontologyCurie":"UBERON:0002107","strand":".","score":0.60938,"quantile":null},{"name":"SPLICE_JUNCTIONS:HepG2","modality":"SPLICE_JUNCTIONS","biosample":"HepG2","ontologyCurie":"EFO:0001187","strand":".","score":0.51123,"quantile":null}]}