{"schemaVersion":"1.1.0","variant":{"id":"chr22-45969257-G-A","chromosome":"chr22","position":45969257,"ref":"G","alt":"A","rsid":null,"gene":"WNT7B"},"provenance":{"source":"atlas-api","clientVersion":"0.9.0","pipelineVersion":"0.1.0","queriedAt":"2026-09-12T19:25:22Z","configHash":"9f77fb0fb548400f","calibrationEpoch":"quantiles>=2026-06-18,indels>=2026-07-14","scorers":["AVI_SCORE","AVI_SCORE_FEATURE_IMPORTANCE","AVI_SCORE_MODEL_FEATURES","RNA_SEQ","ATAC","DNASE","CAGE","PROCAP","CHIP_TF","CHIP_HISTONE","SPLICE_SITE_USAGE","SPLICE_JUNCTIONS","POLYADENYLATION","CONTACT_MAPS"],"hasQuantiles":true},"avi":{"phred":33.98,"quantile":0.99960005,"baseValue":-0.038446,"rawScore":1.897641},"featureFamilies":[{"id":"regulatory","label":"Regulatorio (AlphaGenome)","expectedCount":10},{"id":"protein","label":"Proteina","expectedCount":4},{"id":"conservation","label":"Conservacion","expectedCount":2},{"id":"indel","label":"Indel","expectedCount":2}],"features":[{"id":"MERGED_SPLICING","label":"Splicing (fusionado)","family":"regulatory","contribution":0.209723,"value":0.617969},{"id":"MAX_ABS_ATAC","label":"ATAC","family":"regulatory","contribution":0.106733,"value":3.0404},{"id":"MAX_ABS_CONTACT_MAPS","label":"Mapas de contacto","family":"regulatory","contribution":0.056906,"value":0.055165},{"id":"MAX_ABS_DNASE","label":"DNase","family":"regulatory","contribution":0.065509,"value":3.994911},{"id":"MAX_ABS_CHIP_TF","label":"ChIP-TF","family":"regulatory","contribution":-0.023935,"value":3.385911},{"id":"MAX_ABS_CHIP_HISTONE","label":"ChIP-histonas","family":"regulatory","contribution":0.172475,"value":3.699037},{"id":"MAX_ABS_CAGE","label":"CAGE","family":"regulatory","contribution":0.135832,"value":3.119821},{"id":"MAX_ABS_PROCAP","label":"PRO-cap","family":"regulatory","contribution":0.327082,"value":5.338341},{"id":"MAX_ABS_RNA_SEQ","label":"RNA-seq","family":"regulatory","contribution":0.203774,"value":1.765694},{"id":"MAX_ABS_POLYADENYLATION","label":"Poliadenilacion","family":"regulatory","contribution":0.030867,"value":0.325175},{"id":"ALPHAMISSENSE","label":"AlphaMissense","family":"protein","contribution":0.0,"value":null},{"id":"CACTUS_241_WAY","label":"phyloP Cactus 241-way","family":"conservation","contribution":0.537154,"value":8.373},{"id":"PROTEIN_TERMINATION","label":"Terminacion de proteina","family":"protein","contribution":0.0,"value":0.0},{"id":"START_LOST","label":"Inicio perdido","family":"protein","contribution":0.0,"value":0.0},{"id":"STOP_LOST","label":"Stop perdido","family":"protein","contribution":0.0,"value":0.0},{"id":"PHASTCONS_470_WAY","label":"PhastCons 470-way","family":"conservation","contribution":0.113965,"value":1.0},{"id":"IS_INSERTION","label":"Es insercion","family":"indel","contribution":0.0,"value":0.0},{"id":"IS_DELETION","label":"Es delecion","family":"indel","contribution":0.0,"value":0.0}],"topTracks":[{"name":"PROCAP:MCF 10A","modality":"PROCAP","biosample":"MCF 10A","ontologyCurie":"EFO:0001200","strand":".","score":-5.33834,"quantile":null},{"name":"PROCAP:Calu3","modality":"PROCAP","biosample":"Calu3","ontologyCurie":"EFO:0002819","strand":".","score":-5.1801,"quantile":null},{"name":"PROCAP:endothelial cell of umbilical vein","modality":"PROCAP","biosample":"endothelial cell of umbilical vein","ontologyCurie":"CL:0002618","strand":".","score":-4.75136,"quantile":null},{"name":"DNASE:HCT116","modality":"DNASE","biosample":"HCT116","ontologyCurie":"EFO:0002824","strand":".","score":-3.99491,"quantile":null},{"name":"DNASE:fibroblast of mammary gland","modality":"DNASE","biosample":"fibroblast of mammary gland","ontologyCurie":"CL:0002555","strand":".","score":-3.79326,"quantile":null},{"name":"CHIP_HISTONE:keratinocyte","modality":"CHIP_HISTONE","biosample":"keratinocyte","ontologyCurie":"CL:0000312","strand":".","score":-3.69904,"quantile":null},{"name":"DNASE:cardiac fibroblast","modality":"DNASE","biosample":"cardiac fibroblast","ontologyCurie":"CL:0002548","strand":".","score":-3.69104,"quantile":null},{"name":"CHIP_HISTONE:epithelial cell of prostate","modality":"CHIP_HISTONE","biosample":"epithelial cell of prostate","ontologyCurie":"CL:0002231","strand":".","score":-3.54826,"quantile":null},{"name":"CHIP_HISTONE:RWPE2","modality":"CHIP_HISTONE","biosample":"RWPE2","ontologyCurie":"EFO:0007610","strand":".","score":-3.50665,"quantile":null},{"name":"CHIP_TF:endothelial cell of umbilical vein","modality":"CHIP_TF","biosample":"endothelial cell of umbilical vein","ontologyCurie":"CL:0002618","strand":".","score":-3.38591,"quantile":null},{"name":"CAGE:HT1080","modality":"CAGE","biosample":"HT1080","ontologyCurie":"EFO:0002059","strand":".","score":-3.11982,"quantile":null},{"name":"ATAC:HCT116","modality":"ATAC","biosample":"HCT116","ontologyCurie":"EFO:0002824","strand":".","score":-3.0404,"quantile":null},{"name":"CAGE:A172","modality":"CAGE","biosample":"A172","ontologyCurie":"EFO:0002101","strand":".","score":-3.02586,"quantile":null},{"name":"CAGE:PC-3","modality":"CAGE","biosample":"PC-3","ontologyCurie":"EFO:0002074","strand":".","score":-2.8151,"quantile":null},{"name":"CHIP_TF:HeLa-S3","modality":"CHIP_TF","biosample":"HeLa-S3","ontologyCurie":"EFO:0002791","strand":".","score":-2.81071,"quantile":null},{"name":"CHIP_TF:SK-N-SH","modality":"CHIP_TF","biosample":"SK-N-SH","ontologyCurie":"EFO:0003072","strand":".","score":-2.65363,"quantile":null},{"name":"ATAC:PC-3","modality":"ATAC","biosample":"PC-3","ontologyCurie":"EFO:0002074","strand":".","score":-2.59936,"quantile":null},{"name":"ATAC:RWPE2","modality":"ATAC","biosample":"RWPE2","ontologyCurie":"EFO:0007610","strand":".","score":-2.54264,"quantile":null},{"name":"SPLICE_JUNCTIONS:A549","modality":"SPLICE_JUNCTIONS","biosample":"A549","ontologyCurie":"EFO:0001086","strand":".","score":0.72412,"quantile":null},{"name":"SPLICE_JUNCTIONS:mammary epithelial cell","modality":"SPLICE_JUNCTIONS","biosample":"mammary epithelial cell","ontologyCurie":"CL:0002327","strand":".","score":0.65479,"quantile":null}]}