{"schemaVersion":"1.1.0","variant":{"id":"chr9-128226027-G-A","chromosome":"chr9","position":128226027,"ref":"G","alt":"A","rsid":"rs747079285","gene":"DNM1"},"provenance":{"source":"atlas-api","clientVersion":"0.9.0","pipelineVersion":"0.1.0","queriedAt":"2026-09-13T13:01:16Z","configHash":"e12b11888bbcb030","calibrationEpoch":"quantiles>=2026-06-18,indels>=2026-07-14","scorers":["AVI_SCORE","AVI_SCORE_FEATURE_IMPORTANCE","AVI_SCORE_MODEL_FEATURES","RNA_SEQ","ATAC","DNASE","CAGE","PROCAP","CHIP_TF","CHIP_HISTONE","SPLICE_SITE_USAGE","SPLICE_JUNCTIONS","POLYADENYLATION","CONTACT_MAPS"],"hasQuantiles":true},"avi":{"phred":32.2156,"quantile":0.9993996,"baseValue":-0.037904,"rawScore":1.708427},"featureFamilies":[{"id":"regulatory","label":"Regulatorio (AlphaGenome)","expectedCount":10},{"id":"protein","label":"Proteina","expectedCount":4},{"id":"conservation","label":"Conservacion","expectedCount":2},{"id":"indel","label":"Indel","expectedCount":2}],"features":[{"id":"MERGED_SPLICING","label":"Splicing (fusionado)","family":"regulatory","contribution":1.051869,"value":3.418177},{"id":"MAX_ABS_ATAC","label":"ATAC","family":"regulatory","contribution":0.02398,"value":0.387592},{"id":"MAX_ABS_CONTACT_MAPS","label":"Mapas de contacto","family":"regulatory","contribution":0.002736,"value":0.002216},{"id":"MAX_ABS_DNASE","label":"DNase","family":"regulatory","contribution":0.044841,"value":0.804658},{"id":"MAX_ABS_CHIP_TF","label":"ChIP-TF","family":"regulatory","contribution":0.000361,"value":0.268267},{"id":"MAX_ABS_CHIP_HISTONE","label":"ChIP-histonas","family":"regulatory","contribution":0.01755,"value":0.21635},{"id":"MAX_ABS_CAGE","label":"CAGE","family":"regulatory","contribution":0.021081,"value":0.407895},{"id":"MAX_ABS_PROCAP","label":"PRO-cap","family":"regulatory","contribution":0.009953,"value":0.127116},{"id":"MAX_ABS_RNA_SEQ","label":"RNA-seq","family":"regulatory","contribution":0.003178,"value":0.02804},{"id":"MAX_ABS_POLYADENYLATION","label":"Poliadenilacion","family":"regulatory","contribution":0.001456,"value":0.015572},{"id":"ALPHAMISSENSE","label":"AlphaMissense","family":"protein","contribution":0.0,"value":null},{"id":"CACTUS_241_WAY","label":"phyloP Cactus 241-way","family":"conservation","contribution":0.418381,"value":6.886},{"id":"PROTEIN_TERMINATION","label":"Terminacion de proteina","family":"protein","contribution":0.0,"value":0.0},{"id":"START_LOST","label":"Inicio perdido","family":"protein","contribution":0.0,"value":0.0},{"id":"STOP_LOST","label":"Stop perdido","family":"protein","contribution":0.0,"value":0.0},{"id":"PHASTCONS_470_WAY","label":"PhastCons 470-way","family":"conservation","contribution":0.150944,"value":1.0},{"id":"IS_INSERTION","label":"Es insercion","family":"indel","contribution":0.0,"value":0.0},{"id":"IS_DELETION","label":"Es delecion","family":"indel","contribution":0.0,"value":0.0}],"topTracks":[{"name":"SPLICE_JUNCTIONS:Ammon's horn","modality":"SPLICE_JUNCTIONS","biosample":"Ammon's horn","ontologyCurie":"UBERON:0001954","strand":".","score":7.83203,"quantile":null},{"name":"SPLICE_JUNCTIONS:amygdala","modality":"SPLICE_JUNCTIONS","biosample":"amygdala","ontologyCurie":"UBERON:0001876","strand":".","score":7.78906,"quantile":null},{"name":"SPLICE_JUNCTIONS:caudate nucleus","modality":"SPLICE_JUNCTIONS","biosample":"caudate nucleus","ontologyCurie":"UBERON:0001873","strand":".","score":7.70312,"quantile":null},{"name":"SPLICE_SITE_USAGE:dorsolateral prefrontal cortex","modality":"SPLICE_SITE_USAGE","biosample":"dorsolateral prefrontal cortex","ontologyCurie":"UBERON:0009834","strand":".","score":0.86689,"quantile":null},{"name":"SPLICE_SITE_USAGE:anterior cingulate cortex","modality":"SPLICE_SITE_USAGE","biosample":"anterior cingulate cortex","ontologyCurie":"UBERON:0009835","strand":".","score":0.8591,"quantile":null},{"name":"SPLICE_SITE_USAGE:frontal cortex","modality":"SPLICE_SITE_USAGE","biosample":"frontal cortex","ontologyCurie":"UBERON:0001870","strand":".","score":0.85128,"quantile":null},{"name":"DNASE:RPMI8226","modality":"DNASE","biosample":"RPMI8226","ontologyCurie":"EFO:0002322","strand":".","score":0.80466,"quantile":null},{"name":"DNASE:MM.1S","modality":"DNASE","biosample":"MM.1S","ontologyCurie":"EFO:0005724","strand":".","score":0.67851,"quantile":null},{"name":"DNASE:immature natural killer cell","modality":"DNASE","biosample":"immature natural killer cell","ontologyCurie":"CL:0000823","strand":".","score":-0.46292,"quantile":null},{"name":"CAGE:annulus pulposus cell","modality":"CAGE","biosample":"annulus pulposus cell","ontologyCurie":"CL:0002602","strand":".","score":0.40789,"quantile":null},{"name":"CAGE:nucleus pulposus cell of intervertebral disc","modality":"CAGE","biosample":"nucleus pulposus cell of intervertebral disc","ontologyCurie":"CL:0002564","strand":".","score":0.40435,"quantile":null},{"name":"ATAC:effector memory CD8-positive, alpha-beta T cell","modality":"ATAC","biosample":"effector memory CD8-positive, alpha-beta T cell","ontologyCurie":"CL:0000913","strand":".","score":-0.38759,"quantile":null},{"name":"CAGE:brain","modality":"CAGE","biosample":"brain","ontologyCurie":"UBERON:0000955","strand":".","score":0.38231,"quantile":null},{"name":"ATAC:central memory CD8-positive, alpha-beta T cell","modality":"ATAC","biosample":"central memory CD8-positive, alpha-beta T cell","ontologyCurie":"CL:0000907","strand":".","score":-0.2961,"quantile":null},{"name":"CHIP_TF:GM12878","modality":"CHIP_TF","biosample":"GM12878","ontologyCurie":"EFO:0002784","strand":".","score":-0.26827,"quantile":null},{"name":"CHIP_TF:HEK293","modality":"CHIP_TF","biosample":"HEK293","ontologyCurie":"EFO:0001182","strand":".","score":0.26344,"quantile":null},{"name":"ATAC:CD8-positive, alpha-beta T cell","modality":"ATAC","biosample":"CD8-positive, alpha-beta T cell","ontologyCurie":"CL:0000625","strand":".","score":-0.26308,"quantile":null},{"name":"CHIP_TF:H1","modality":"CHIP_TF","biosample":"H1","ontologyCurie":"EFO:0003042","strand":".","score":0.23769,"quantile":null},{"name":"CHIP_HISTONE:OCI-LY7","modality":"CHIP_HISTONE","biosample":"OCI-LY7","ontologyCurie":"EFO:0006711","strand":".","score":0.21635,"quantile":null},{"name":"CHIP_HISTONE:natural killer cell","modality":"CHIP_HISTONE","biosample":"natural killer cell","ontologyCurie":"CL:0000623","strand":".","score":-0.14651,"quantile":null}]}