{"schemaVersion":"1.1.0","variant":{"id":"chrX-101386224-T-C","chromosome":"chrX","position":101386224,"ref":"T","alt":"C","rsid":null,"gene":"BTK"},"provenance":{"source":"atlas-api","clientVersion":"0.9.0","pipelineVersion":"0.1.0","queriedAt":"2026-09-12T19:26:11Z","configHash":"1dd338f7a28175b8","calibrationEpoch":"quantiles>=2026-06-18,indels>=2026-07-14","scorers":["AVI_SCORE","AVI_SCORE_FEATURE_IMPORTANCE","AVI_SCORE_MODEL_FEATURES","RNA_SEQ","ATAC","DNASE","CAGE","PROCAP","CHIP_TF","CHIP_HISTONE","SPLICE_SITE_USAGE","SPLICE_JUNCTIONS","POLYADENYLATION","CONTACT_MAPS"],"hasQuantiles":true},"avi":{"phred":49.025,"quantile":0.99998748,"baseValue":-0.049137,"rawScore":2.762104},"featureFamilies":[{"id":"regulatory","label":"Regulatorio (AlphaGenome)","expectedCount":10},{"id":"protein","label":"Proteina","expectedCount":4},{"id":"conservation","label":"Conservacion","expectedCount":2},{"id":"indel","label":"Indel","expectedCount":2}],"features":[{"id":"MERGED_SPLICING","label":"Splicing (fusionado)","family":"regulatory","contribution":0.769333,"value":2.179492},{"id":"MAX_ABS_ATAC","label":"ATAC","family":"regulatory","contribution":0.176494,"value":5.762238},{"id":"MAX_ABS_CONTACT_MAPS","label":"Mapas de contacto","family":"regulatory","contribution":0.033055,"value":0.033642},{"id":"MAX_ABS_DNASE","label":"DNase","family":"regulatory","contribution":0.017951,"value":5.11795},{"id":"MAX_ABS_CHIP_TF","label":"ChIP-TF","family":"regulatory","contribution":8.3e-05,"value":4.426817},{"id":"MAX_ABS_CHIP_HISTONE","label":"ChIP-histonas","family":"regulatory","contribution":0.269892,"value":5.636148},{"id":"MAX_ABS_CAGE","label":"CAGE","family":"regulatory","contribution":0.369995,"value":7.268569},{"id":"MAX_ABS_PROCAP","label":"PRO-cap","family":"regulatory","contribution":0.060566,"value":0.949102},{"id":"MAX_ABS_RNA_SEQ","label":"RNA-seq","family":"regulatory","contribution":0.537914,"value":5.037588},{"id":"MAX_ABS_POLYADENYLATION","label":"Poliadenilacion","family":"regulatory","contribution":0.0,"value":0.0},{"id":"ALPHAMISSENSE","label":"AlphaMissense","family":"protein","contribution":0.0,"value":null},{"id":"CACTUS_241_WAY","label":"phyloP Cactus 241-way","family":"conservation","contribution":0.350951,"value":5.169},{"id":"PROTEIN_TERMINATION","label":"Terminacion de proteina","family":"protein","contribution":0.0,"value":0.0},{"id":"START_LOST","label":"Inicio perdido","family":"protein","contribution":0.0,"value":0.0},{"id":"STOP_LOST","label":"Stop perdido","family":"protein","contribution":0.0,"value":0.0},{"id":"PHASTCONS_470_WAY","label":"PhastCons 470-way","family":"conservation","contribution":0.225007,"value":1.0},{"id":"IS_INSERTION","label":"Es insercion","family":"indel","contribution":0.0,"value":0.0},{"id":"IS_DELETION","label":"Es delecion","family":"indel","contribution":0.0,"value":0.0}],"topTracks":[{"name":"CAGE:CD14-positive, CD16-negative classical monocyte","modality":"CAGE","biosample":"CD14-positive, CD16-negative classical monocyte","ontologyCurie":"CL:0002057","strand":".","score":-7.26857,"quantile":null},{"name":"CAGE:CD14-positive, CD16-positive monocyte","modality":"CAGE","biosample":"CD14-positive, CD16-positive monocyte","ontologyCurie":"CL:0002397","strand":".","score":-7.02903,"quantile":null},{"name":"CAGE:basophil","modality":"CAGE","biosample":"basophil","ontologyCurie":"CL:0000767","strand":".","score":-6.84088,"quantile":null},{"name":"SPLICE_JUNCTIONS:CD14-positive monocyte","modality":"SPLICE_JUNCTIONS","biosample":"CD14-positive monocyte","ontologyCurie":"CL:0001054","strand":".","score":5.89062,"quantile":null},{"name":"ATAC:memory B cell","modality":"ATAC","biosample":"memory B cell","ontologyCurie":"CL:0000787","strand":".","score":-5.76224,"quantile":null},{"name":"ATAC:naive B cell","modality":"ATAC","biosample":"naive B cell","ontologyCurie":"CL:0000788","strand":".","score":-5.65734,"quantile":null},{"name":"CHIP_HISTONE:CD14-positive monocyte","modality":"CHIP_HISTONE","biosample":"CD14-positive monocyte","ontologyCurie":"CL:0001054","strand":".","score":-5.63615,"quantile":null},{"name":"ATAC:B cell","modality":"ATAC","biosample":"B cell","ontologyCurie":"CL:0000236","strand":".","score":-5.5783,"quantile":null},{"name":"DNASE:CD14-positive monocyte","modality":"DNASE","biosample":"CD14-positive monocyte","ontologyCurie":"CL:0001054","strand":".","score":-5.11795,"quantile":null},{"name":"CHIP_HISTONE:HL-60","modality":"CHIP_HISTONE","biosample":"HL-60","ontologyCurie":"EFO:0002793","strand":".","score":-4.72378,"quantile":null},{"name":"DNASE:naive B cell","modality":"DNASE","biosample":"naive B cell","ontologyCurie":"CL:0000788","strand":".","score":-4.63173,"quantile":null},{"name":"SPLICE_JUNCTIONS:venous blood","modality":"SPLICE_JUNCTIONS","biosample":"venous blood","ontologyCurie":"UBERON:0013756","strand":".","score":4.55469,"quantile":null},{"name":"DNASE:inflammatory macrophage","modality":"DNASE","biosample":"inflammatory macrophage","ontologyCurie":"CL:0000863","strand":".","score":-4.47748,"quantile":null},{"name":"CHIP_TF:GM12891","modality":"CHIP_TF","biosample":"GM12891","ontologyCurie":"EFO:0002785","strand":".","score":-4.42682,"quantile":null},{"name":"SPLICE_JUNCTIONS:B cell","modality":"SPLICE_JUNCTIONS","biosample":"B cell","ontologyCurie":"CL:0000236","strand":".","score":4.30469,"quantile":null},{"name":"CHIP_HISTONE:neutrophil","modality":"CHIP_HISTONE","biosample":"neutrophil","ontologyCurie":"CL:0000775","strand":".","score":-4.20802,"quantile":null},{"name":"CHIP_TF:GM12878","modality":"CHIP_TF","biosample":"GM12878","ontologyCurie":"EFO:0002784","strand":".","score":-3.82378,"quantile":null},{"name":"CHIP_TF:HL-60","modality":"CHIP_TF","biosample":"HL-60","ontologyCurie":"EFO:0002793","strand":".","score":-3.7471,"quantile":null},{"name":"PROCAP:Calu3","modality":"PROCAP","biosample":"Calu3","ontologyCurie":"EFO:0002819","strand":".","score":-0.9491,"quantile":null},{"name":"PROCAP:endothelial cell of umbilical vein","modality":"PROCAP","biosample":"endothelial cell of umbilical vein","ontologyCurie":"CL:0002618","strand":".","score":-0.7604,"quantile":null}]}