{"schemaVersion":"1.1.0","variant":{"id":"chr12-54578515-C-A","chromosome":"chr12","position":54578515,"ref":"C","alt":"A","rsid":null,"gene":"PPP1R1A"},"provenance":{"source":"atlas-api","clientVersion":"0.9.0","pipelineVersion":"0.1.0","queriedAt":"2026-09-11T12:34:58Z","configHash":"8e43489c33743b7e","calibrationEpoch":"quantiles>=2026-06-18,indels>=2026-07-14","scorers":["AVI_SCORE","AVI_SCORE_FEATURE_IMPORTANCE","AVI_SCORE_MODEL_FEATURES","RNA_SEQ","ATAC","DNASE","CAGE","PROCAP","CHIP_TF","CHIP_HISTONE","SPLICE_SITE_USAGE","SPLICE_JUNCTIONS","POLYADENYLATION","CONTACT_MAPS"],"hasQuantiles":true},"avi":{"phred":4.4287,"quantile":0.63930953,"baseValue":-0.049026,"rawScore":0.021607},"featureFamilies":[{"id":"regulatory","label":"Regulatorio (AlphaGenome)","expectedCount":10},{"id":"protein","label":"Proteina","expectedCount":4},{"id":"conservation","label":"Conservacion","expectedCount":2},{"id":"indel","label":"Indel","expectedCount":2}],"features":[{"id":"MERGED_SPLICING","label":"Splicing (fusionado)","family":"regulatory","contribution":0.174574,"value":0.590869},{"id":"MAX_ABS_ATAC","label":"ATAC","family":"regulatory","contribution":0.004812,"value":0.070517},{"id":"MAX_ABS_CONTACT_MAPS","label":"Mapas de contacto","family":"regulatory","contribution":0.001928,"value":0.001695},{"id":"MAX_ABS_DNASE","label":"DNase","family":"regulatory","contribution":0.006592,"value":0.085506},{"id":"MAX_ABS_CHIP_TF","label":"ChIP-TF","family":"regulatory","contribution":0.000389,"value":0.060794},{"id":"MAX_ABS_CHIP_HISTONE","label":"ChIP-histonas","family":"regulatory","contribution":0.004561,"value":0.049864},{"id":"MAX_ABS_CAGE","label":"CAGE","family":"regulatory","contribution":0.002725,"value":0.057559},{"id":"MAX_ABS_PROCAP","label":"PRO-cap","family":"regulatory","contribution":0.00408,"value":0.049164},{"id":"MAX_ABS_RNA_SEQ","label":"RNA-seq","family":"regulatory","contribution":0.004398,"value":0.045849},{"id":"MAX_ABS_POLYADENYLATION","label":"Poliadenilacion","family":"regulatory","contribution":0.008456,"value":0.085891},{"id":"ALPHAMISSENSE","label":"AlphaMissense","family":"protein","contribution":0.0,"value":null},{"id":"CACTUS_241_WAY","label":"phyloP Cactus 241-way","family":"conservation","contribution":-0.141881,"value":-2.305},{"id":"PROTEIN_TERMINATION","label":"Terminacion de proteina","family":"protein","contribution":0.0,"value":0.0},{"id":"START_LOST","label":"Inicio perdido","family":"protein","contribution":0.0,"value":0.0},{"id":"STOP_LOST","label":"Stop perdido","family":"protein","contribution":0.0,"value":0.0},{"id":"PHASTCONS_470_WAY","label":"PhastCons 470-way","family":"conservation","contribution":0.0,"value":0.0},{"id":"IS_INSERTION","label":"Es insercion","family":"indel","contribution":0.0,"value":0.0},{"id":"IS_DELETION","label":"Es delecion","family":"indel","contribution":0.0,"value":0.0}],"topTracks":[{"name":"SPLICE_JUNCTIONS:caudate nucleus","modality":"SPLICE_JUNCTIONS","biosample":"caudate nucleus","ontologyCurie":"UBERON:0001873","strand":".","score":0.99268,"quantile":null},{"name":"SPLICE_JUNCTIONS:nucleus accumbens","modality":"SPLICE_JUNCTIONS","biosample":"nucleus accumbens","ontologyCurie":"UBERON:0001882","strand":".","score":0.99219,"quantile":null},{"name":"SPLICE_JUNCTIONS:hypothalamus","modality":"SPLICE_JUNCTIONS","biosample":"hypothalamus","ontologyCurie":"UBERON:0001898","strand":".","score":0.9917,"quantile":null},{"name":"DNASE:H7","modality":"DNASE","biosample":"H7","ontologyCurie":"EFO:0005904","strand":".","score":0.08551,"quantile":null},{"name":"DNASE:mesendoderm","modality":"DNASE","biosample":"mesendoderm","ontologyCurie":"NTR:0000856","strand":".","score":0.07479,"quantile":null},{"name":"ATAC:motor neuron","modality":"ATAC","biosample":"motor neuron","ontologyCurie":"CL:0000100","strand":".","score":-0.07052,"quantile":null},{"name":"ATAC:PC-3","modality":"ATAC","biosample":"PC-3","ontologyCurie":"EFO:0002074","strand":".","score":-0.0625,"quantile":null},{"name":"CHIP_TF:H1","modality":"CHIP_TF","biosample":"H1","ontologyCurie":"EFO:0003042","strand":".","score":-0.06079,"quantile":null},{"name":"CAGE:seminal vesicle","modality":"CAGE","biosample":"seminal vesicle","ontologyCurie":"UBERON:0000998","strand":".","score":-0.05756,"quantile":null},{"name":"ATAC:spleen","modality":"ATAC","biosample":"spleen","ontologyCurie":"UBERON:0002106","strand":".","score":-0.0546,"quantile":null},{"name":"CHIP_TF:HEK293","modality":"CHIP_TF","biosample":"HEK293","ontologyCurie":"EFO:0001182","strand":".","score":-0.05193,"quantile":null},{"name":"CHIP_TF:MCF-7","modality":"CHIP_TF","biosample":"MCF-7","ontologyCurie":"EFO:0001203","strand":".","score":-0.0509,"quantile":null},{"name":"CAGE:parotid gland","modality":"CAGE","biosample":"parotid gland","ontologyCurie":"UBERON:0001831","strand":".","score":-0.04987,"quantile":null},{"name":"CHIP_HISTONE:endodermal cell","modality":"CHIP_HISTONE","biosample":"endodermal cell","ontologyCurie":"CL:0000223","strand":".","score":0.04986,"quantile":null},{"name":"PROCAP:Caco-2","modality":"PROCAP","biosample":"Caco-2","ontologyCurie":"EFO:0001099","strand":".","score":0.04916,"quantile":null},{"name":"CAGE:testis","modality":"CAGE","biosample":"testis","ontologyCurie":"UBERON:0000473","strand":".","score":-0.04864,"quantile":null},{"name":"POLYADENYLATION:CD8-positive, alpha-beta T cell","modality":"POLYADENYLATION","biosample":"CD8-positive, alpha-beta T cell","ontologyCurie":"CL:0000625","strand":".","score":0.04289,"quantile":null},{"name":"POLYADENYLATION:foreskin keratinocyte","modality":"POLYADENYLATION","biosample":"foreskin keratinocyte","ontologyCurie":"CL:1001606","strand":".","score":0.0425,"quantile":null},{"name":"CHIP_HISTONE:mesodermal cell","modality":"CHIP_HISTONE","biosample":"mesodermal cell","ontologyCurie":"CL:0000222","strand":".","score":0.04235,"quantile":null},{"name":"POLYADENYLATION:CD4-positive, alpha-beta T cell","modality":"POLYADENYLATION","biosample":"CD4-positive, alpha-beta T cell","ontologyCurie":"CL:0000624","strand":".","score":0.03876,"quantile":null}]}