{"schemaVersion":"1.1.0","variant":{"id":"chr11-116837649-T-G","chromosome":"chr11","position":116837649,"ref":"T","alt":"G","rsid":null,"gene":"APOA1"},"provenance":{"source":"atlas-api","clientVersion":"0.9.0","pipelineVersion":"0.1.0","queriedAt":"2026-09-12T20:39:11Z","configHash":"63b7cc8d64f3302f","calibrationEpoch":"quantiles>=2026-06-18,indels>=2026-07-14","scorers":["AVI_SCORE","AVI_SCORE_FEATURE_IMPORTANCE","AVI_SCORE_MODEL_FEATURES","RNA_SEQ","ATAC","DNASE","CAGE","PROCAP","CHIP_TF","CHIP_HISTONE","SPLICE_SITE_USAGE","SPLICE_JUNCTIONS","POLYADENYLATION","CONTACT_MAPS"],"hasQuantiles":true},"avi":{"phred":25.9606,"quantile":0.99746519,"baseValue":-0.044401,"rawScore":1.267733},"featureFamilies":[{"id":"regulatory","label":"Regulatorio (AlphaGenome)","expectedCount":10},{"id":"protein","label":"Proteina","expectedCount":4},{"id":"conservation","label":"Conservacion","expectedCount":2},{"id":"indel","label":"Indel","expectedCount":2}],"features":[{"id":"MERGED_SPLICING","label":"Splicing (fusionado)","family":"regulatory","contribution":0.0,"value":0.0},{"id":"MAX_ABS_ATAC","label":"ATAC","family":"regulatory","contribution":0.065236,"value":1.340153},{"id":"MAX_ABS_CONTACT_MAPS","label":"Mapas de contacto","family":"regulatory","contribution":0.010888,"value":0.010024},{"id":"MAX_ABS_DNASE","label":"DNase","family":"regulatory","contribution":0.046045,"value":1.373914},{"id":"MAX_ABS_CHIP_TF","label":"ChIP-TF","family":"regulatory","contribution":-0.00433,"value":0.742899},{"id":"MAX_ABS_CHIP_HISTONE","label":"ChIP-histonas","family":"regulatory","contribution":0.101954,"value":1.750401},{"id":"MAX_ABS_CAGE","label":"CAGE","family":"regulatory","contribution":0.146542,"value":2.946116},{"id":"MAX_ABS_PROCAP","label":"PRO-cap","family":"regulatory","contribution":0.224501,"value":3.385858},{"id":"MAX_ABS_RNA_SEQ","label":"RNA-seq","family":"regulatory","contribution":0.276646,"value":2.657296},{"id":"MAX_ABS_POLYADENYLATION","label":"Poliadenilacion","family":"regulatory","contribution":0.0,"value":0.0},{"id":"ALPHAMISSENSE","label":"AlphaMissense","family":"protein","contribution":0.0,"value":null},{"id":"CACTUS_241_WAY","label":"phyloP Cactus 241-way","family":"conservation","contribution":0.292218,"value":4.69},{"id":"PROTEIN_TERMINATION","label":"Terminacion de proteina","family":"protein","contribution":0.0,"value":0.0},{"id":"START_LOST","label":"Inicio perdido","family":"protein","contribution":0.0,"value":0.0},{"id":"STOP_LOST","label":"Stop perdido","family":"protein","contribution":0.0,"value":0.0},{"id":"PHASTCONS_470_WAY","label":"PhastCons 470-way","family":"conservation","contribution":0.152435,"value":1.0},{"id":"IS_INSERTION","label":"Es insercion","family":"indel","contribution":0.0,"value":0.0},{"id":"IS_DELETION","label":"Es delecion","family":"indel","contribution":0.0,"value":0.0}],"topTracks":[{"name":"PROCAP:A673","modality":"PROCAP","biosample":"A673","ontologyCurie":"EFO:0002106","strand":".","score":-3.38586,"quantile":null},{"name":"PROCAP:endothelial cell of umbilical vein","modality":"PROCAP","biosample":"endothelial cell of umbilical vein","ontologyCurie":"CL:0002618","strand":".","score":-2.96206,"quantile":null},{"name":"CAGE:esophagus","modality":"CAGE","biosample":"esophagus","ontologyCurie":"UBERON:0001043","strand":".","score":-2.94612,"quantile":null},{"name":"CAGE:heart left ventricle","modality":"CAGE","biosample":"heart left ventricle","ontologyCurie":"UBERON:0002084","strand":".","score":-2.94584,"quantile":null},{"name":"CAGE:mitral valve","modality":"CAGE","biosample":"mitral valve","ontologyCurie":"UBERON:0002135","strand":".","score":-2.85324,"quantile":null},{"name":"PROCAP:Calu3","modality":"PROCAP","biosample":"Calu3","ontologyCurie":"EFO:0002819","strand":".","score":-2.66404,"quantile":null},{"name":"CHIP_HISTONE:left ventricle myocardium inferior","modality":"CHIP_HISTONE","biosample":"left ventricle myocardium inferior","ontologyCurie":"NTR:0000493","strand":".","score":-1.7504,"quantile":null},{"name":"CHIP_HISTONE:right atrium auricular region","modality":"CHIP_HISTONE","biosample":"right atrium auricular region","ontologyCurie":"UBERON:0006631","strand":".","score":-1.57729,"quantile":null},{"name":"DNASE:heart","modality":"DNASE","biosample":"heart","ontologyCurie":"UBERON:0000948","strand":".","score":-1.37391,"quantile":null},{"name":"ATAC:left ventricle myocardium superior","modality":"ATAC","biosample":"left ventricle myocardium superior","ontologyCurie":"NTR:0000494","strand":".","score":-1.34015,"quantile":null},{"name":"CHIP_HISTONE:heart","modality":"CHIP_HISTONE","biosample":"heart","ontologyCurie":"UBERON:0000948","strand":".","score":-1.18741,"quantile":null},{"name":"ATAC:Right ventricle myocardium superior","modality":"ATAC","biosample":"Right ventricle myocardium superior","ontologyCurie":"NTR:0000492","strand":".","score":-1.15536,"quantile":null},{"name":"ATAC:heart left ventricle","modality":"ATAC","biosample":"heart left ventricle","ontologyCurie":"UBERON:0002084","strand":".","score":-0.95836,"quantile":null},{"name":"DNASE:left ventricle myocardium superior","modality":"DNASE","biosample":"left ventricle myocardium superior","ontologyCurie":"NTR:0000494","strand":".","score":-0.85837,"quantile":null},{"name":"DNASE:amniotic epithelial cell","modality":"DNASE","biosample":"amniotic epithelial cell","ontologyCurie":"CL:0002536","strand":".","score":-0.7465,"quantile":null},{"name":"CHIP_TF:heart left ventricle","modality":"CHIP_TF","biosample":"heart left ventricle","ontologyCurie":"UBERON:0002084","strand":".","score":-0.7429,"quantile":null},{"name":"CHIP_TF:stomach","modality":"CHIP_TF","biosample":"stomach","ontologyCurie":"UBERON:0000945","strand":".","score":-0.70585,"quantile":null},{"name":"CHIP_TF:gastrocnemius medialis","modality":"CHIP_TF","biosample":"gastrocnemius medialis","ontologyCurie":"UBERON:0011907","strand":".","score":-0.6931,"quantile":null},{"name":"CONTACT_MAPS:H1-hESC","modality":"CONTACT_MAPS","biosample":"H1-hESC","ontologyCurie":"EFO:0003042","strand":".","score":0.01002,"quantile":null},{"name":"CONTACT_MAPS:HFFc6","modality":"CONTACT_MAPS","biosample":"HFFc6","ontologyCurie":"EFO:0009318","strand":".","score":0.01001,"quantile":null}]}