{"schemaVersion":"1.1.0","variant":{"id":"chr1-109274968-G-T","chromosome":"chr1","position":109274968,"ref":"G","alt":"T","rsid":"rs12740374","gene":"CELSR2"},"provenance":{"source":"atlas-api","clientVersion":"0.9.0","pipelineVersion":"0.1.0","queriedAt":"2026-09-13T14:01:13Z","configHash":"4bd0cff034a78449","calibrationEpoch":"quantiles>=2026-06-18,indels>=2026-07-14","scorers":["AVI_SCORE","AVI_SCORE_FEATURE_IMPORTANCE","AVI_SCORE_MODEL_FEATURES","RNA_SEQ","ATAC","DNASE","CAGE","PROCAP","CHIP_TF","CHIP_HISTONE","SPLICE_SITE_USAGE","SPLICE_JUNCTIONS","POLYADENYLATION","CONTACT_MAPS"],"hasQuantiles":true},"avi":{"phred":21.7612,"quantile":0.99333376,"baseValue":-0.057919,"rawScore":0.683802},"featureFamilies":[{"id":"regulatory","label":"Regulatorio (AlphaGenome)","expectedCount":10},{"id":"protein","label":"Proteina","expectedCount":4},{"id":"conservation","label":"Conservacion","expectedCount":2},{"id":"indel","label":"Indel","expectedCount":2}],"features":[{"id":"MERGED_SPLICING","label":"Splicing (fusionado)","family":"regulatory","contribution":0.063499,"value":0.198047},{"id":"MAX_ABS_ATAC","label":"ATAC","family":"regulatory","contribution":0.07774,"value":1.767879},{"id":"MAX_ABS_CONTACT_MAPS","label":"Mapas de contacto","family":"regulatory","contribution":0.015072,"value":0.014126},{"id":"MAX_ABS_DNASE","label":"DNase","family":"regulatory","contribution":0.09712,"value":3.388879},{"id":"MAX_ABS_CHIP_TF","label":"ChIP-TF","family":"regulatory","contribution":-0.016067,"value":3.840676},{"id":"MAX_ABS_CHIP_HISTONE","label":"ChIP-histonas","family":"regulatory","contribution":0.092481,"value":1.66752},{"id":"MAX_ABS_CAGE","label":"CAGE","family":"regulatory","contribution":0.080023,"value":1.759551},{"id":"MAX_ABS_PROCAP","label":"PRO-cap","family":"regulatory","contribution":0.086375,"value":1.376965},{"id":"MAX_ABS_RNA_SEQ","label":"RNA-seq","family":"regulatory","contribution":0.086816,"value":0.822456},{"id":"MAX_ABS_POLYADENYLATION","label":"Poliadenilacion","family":"regulatory","contribution":0.050212,"value":0.519288},{"id":"ALPHAMISSENSE","label":"AlphaMissense","family":"protein","contribution":0.0,"value":null},{"id":"CACTUS_241_WAY","label":"phyloP Cactus 241-way","family":"conservation","contribution":0.021363,"value":0.351},{"id":"PROTEIN_TERMINATION","label":"Terminacion de proteina","family":"protein","contribution":0.0,"value":0.0},{"id":"START_LOST","label":"Inicio perdido","family":"protein","contribution":0.0,"value":0.0},{"id":"STOP_LOST","label":"Stop perdido","family":"protein","contribution":0.0,"value":0.0},{"id":"PHASTCONS_470_WAY","label":"PhastCons 470-way","family":"conservation","contribution":0.087086,"value":0.95},{"id":"IS_INSERTION","label":"Es insercion","family":"indel","contribution":0.0,"value":0.0},{"id":"IS_DELETION","label":"Es delecion","family":"indel","contribution":0.0,"value":0.0}],"topTracks":[{"name":"CHIP_TF:IMR-90","modality":"CHIP_TF","biosample":"IMR-90","ontologyCurie":"EFO:0001196","strand":".","score":3.84068,"quantile":null},{"name":"CHIP_TF:K562","modality":"CHIP_TF","biosample":"K562","ontologyCurie":"EFO:0002067","strand":".","score":3.4573,"quantile":null},{"name":"DNASE:fibroblast of mammary gland","modality":"DNASE","biosample":"fibroblast of mammary gland","ontologyCurie":"CL:0002555","strand":".","score":3.38888,"quantile":null},{"name":"DNASE:fibroblast of pulmonary artery","modality":"DNASE","biosample":"fibroblast of pulmonary artery","ontologyCurie":"CL:0002557","strand":".","score":3.0403,"quantile":null},{"name":"DNASE:amniotic epithelial cell","modality":"DNASE","biosample":"amniotic epithelial cell","ontologyCurie":"CL:0002536","strand":".","score":3.01837,"quantile":null},{"name":"CHIP_TF:HepG2","modality":"CHIP_TF","biosample":"HepG2","ontologyCurie":"EFO:0001187","strand":".","score":2.88676,"quantile":null},{"name":"ATAC:gastrocnemius medialis","modality":"ATAC","biosample":"gastrocnemius medialis","ontologyCurie":"UBERON:0011907","strand":".","score":1.76788,"quantile":null},{"name":"CAGE:liver","modality":"CAGE","biosample":"liver","ontologyCurie":"UBERON:0002107","strand":".","score":1.75955,"quantile":null},{"name":"CHIP_HISTONE:liver","modality":"CHIP_HISTONE","biosample":"liver","ontologyCurie":"UBERON:0002107","strand":".","score":1.66752,"quantile":null},{"name":"CHIP_HISTONE:CD14-positive monocyte","modality":"CHIP_HISTONE","biosample":"CD14-positive monocyte","ontologyCurie":"CL:0001054","strand":".","score":1.66125,"quantile":null},{"name":"ATAC:right lobe of liver","modality":"ATAC","biosample":"right lobe of liver","ontologyCurie":"UBERON:0001114","strand":".","score":1.62344,"quantile":null},{"name":"ATAC:left lobe of liver","modality":"ATAC","biosample":"left lobe of liver","ontologyCurie":"UBERON:0001115","strand":".","score":1.52326,"quantile":null},{"name":"CHIP_HISTONE:ACC112","modality":"CHIP_HISTONE","biosample":"ACC112","ontologyCurie":"EFO:0007070","strand":".","score":1.49958,"quantile":null},{"name":"CAGE:HepG2","modality":"CAGE","biosample":"HepG2","ontologyCurie":"EFO:0001187","strand":".","score":1.42224,"quantile":null},{"name":"PROCAP:MCF 10A","modality":"PROCAP","biosample":"MCF 10A","ontologyCurie":"EFO:0001200","strand":".","score":1.37696,"quantile":null},{"name":"CAGE:basophil","modality":"CAGE","biosample":"basophil","ontologyCurie":"CL:0000767","strand":".","score":1.33566,"quantile":null},{"name":"PROCAP:A673","modality":"PROCAP","biosample":"A673","ontologyCurie":"EFO:0002106","strand":".","score":0.73998,"quantile":null},{"name":"PROCAP:Calu3","modality":"PROCAP","biosample":"Calu3","ontologyCurie":"EFO:0002819","strand":".","score":-0.72575,"quantile":null},{"name":"SPLICE_JUNCTIONS:HepG2","modality":"SPLICE_JUNCTIONS","biosample":"HepG2","ontologyCurie":"EFO:0001187","strand":".","score":0.38135,"quantile":null},{"name":"SPLICE_JUNCTIONS:Ammon's horn","modality":"SPLICE_JUNCTIONS","biosample":"Ammon's horn","ontologyCurie":"UBERON:0001954","strand":".","score":0.30908,"quantile":null}]}