{"schemaVersion":"1.1.0","variant":{"id":"chr12-54578515-C-G","chromosome":"chr12","position":54578515,"ref":"C","alt":"G","rsid":null,"gene":"PPP1R1A"},"provenance":{"source":"atlas-api","clientVersion":"0.9.0","pipelineVersion":"0.1.0","queriedAt":"2026-09-11T12:52:57Z","configHash":"8e43489c33743b7e","calibrationEpoch":"quantiles>=2026-06-18,indels>=2026-07-14","scorers":["AVI_SCORE","AVI_SCORE_FEATURE_IMPORTANCE","AVI_SCORE_MODEL_FEATURES","RNA_SEQ","ATAC","DNASE","CAGE","PROCAP","CHIP_TF","CHIP_HISTONE","SPLICE_SITE_USAGE","SPLICE_JUNCTIONS","POLYADENYLATION","CONTACT_MAPS"],"hasQuantiles":true},"avi":{"phred":5.3706,"quantile":0.70963538,"baseValue":-0.048994,"rawScore":0.036748},"featureFamilies":[{"id":"regulatory","label":"Regulatorio (AlphaGenome)","expectedCount":10},{"id":"protein","label":"Proteina","expectedCount":4},{"id":"conservation","label":"Conservacion","expectedCount":2},{"id":"indel","label":"Indel","expectedCount":2}],"features":[{"id":"MERGED_SPLICING","label":"Splicing (fusionado)","family":"regulatory","contribution":0.213507,"value":0.724512},{"id":"MAX_ABS_ATAC","label":"ATAC","family":"regulatory","contribution":0.001623,"value":0.023436},{"id":"MAX_ABS_CONTACT_MAPS","label":"Mapas de contacto","family":"regulatory","contribution":0.001467,"value":0.001282},{"id":"MAX_ABS_DNASE","label":"DNase","family":"regulatory","contribution":0.001395,"value":0.017898},{"id":"MAX_ABS_CHIP_TF","label":"ChIP-TF","family":"regulatory","contribution":0.000224,"value":0.033167},{"id":"MAX_ABS_CHIP_HISTONE","label":"ChIP-histonas","family":"regulatory","contribution":0.001393,"value":0.015064},{"id":"MAX_ABS_CAGE","label":"CAGE","family":"regulatory","contribution":0.002007,"value":0.042253},{"id":"MAX_ABS_PROCAP","label":"PRO-cap","family":"regulatory","contribution":0.001709,"value":0.020454},{"id":"MAX_ABS_RNA_SEQ","label":"RNA-seq","family":"regulatory","contribution":0.001788,"value":0.018626},{"id":"MAX_ABS_POLYADENYLATION","label":"Poliadenilacion","family":"regulatory","contribution":0.002488,"value":0.025311},{"id":"ALPHAMISSENSE","label":"AlphaMissense","family":"protein","contribution":0.0,"value":null},{"id":"CACTUS_241_WAY","label":"phyloP Cactus 241-way","family":"conservation","contribution":-0.141859,"value":-2.305},{"id":"PROTEIN_TERMINATION","label":"Terminacion de proteina","family":"protein","contribution":0.0,"value":0.0},{"id":"START_LOST","label":"Inicio perdido","family":"protein","contribution":0.0,"value":0.0},{"id":"STOP_LOST","label":"Stop perdido","family":"protein","contribution":0.0,"value":0.0},{"id":"PHASTCONS_470_WAY","label":"PhastCons 470-way","family":"conservation","contribution":0.0,"value":0.0},{"id":"IS_INSERTION","label":"Es insercion","family":"indel","contribution":0.0,"value":0.0},{"id":"IS_DELETION","label":"Es delecion","family":"indel","contribution":0.0,"value":0.0}],"topTracks":[{"name":"SPLICE_JUNCTIONS:hypothalamus","modality":"SPLICE_JUNCTIONS","biosample":"hypothalamus","ontologyCurie":"UBERON:0001898","strand":".","score":1.47656,"quantile":null},{"name":"SPLICE_JUNCTIONS:caudate nucleus","modality":"SPLICE_JUNCTIONS","biosample":"caudate nucleus","ontologyCurie":"UBERON:0001873","strand":".","score":1.47363,"quantile":null},{"name":"SPLICE_JUNCTIONS:Ammon's horn","modality":"SPLICE_JUNCTIONS","biosample":"Ammon's horn","ontologyCurie":"UBERON:0001954","strand":".","score":1.47363,"quantile":null},{"name":"CAGE:fungiform papilla","modality":"CAGE","biosample":"fungiform papilla","ontologyCurie":"UBERON:0002448","strand":".","score":-0.04225,"quantile":null},{"name":"CHIP_TF:HEK293","modality":"CHIP_TF","biosample":"HEK293","ontologyCurie":"EFO:0001182","strand":".","score":-0.03317,"quantile":null},{"name":"CAGE:nail plate","modality":"CAGE","biosample":"nail plate","ontologyCurie":"UBERON:0008198","strand":".","score":-0.03169,"quantile":null},{"name":"CAGE:urethra","modality":"CAGE","biosample":"urethra","ontologyCurie":"UBERON:0000057","strand":".","score":-0.03125,"quantile":null},{"name":"CHIP_TF:H1","modality":"CHIP_TF","biosample":"H1","ontologyCurie":"EFO:0003042","strand":".","score":-0.02818,"quantile":null},{"name":"CHIP_TF:K562","modality":"CHIP_TF","biosample":"K562","ontologyCurie":"EFO:0002067","strand":".","score":-0.02651,"quantile":null},{"name":"ATAC:motor neuron","modality":"ATAC","biosample":"motor neuron","ontologyCurie":"CL:0000100","strand":".","score":-0.02344,"quantile":null},{"name":"POLYADENYLATION:CD14-positive monocyte","modality":"POLYADENYLATION","biosample":"CD14-positive monocyte","ontologyCurie":"CL:0001054","strand":".","score":0.02114,"quantile":null},{"name":"PROCAP:Caco-2","modality":"PROCAP","biosample":"Caco-2","ontologyCurie":"EFO:0001099","strand":".","score":0.02045,"quantile":null},{"name":"POLYADENYLATION:K562","modality":"POLYADENYLATION","biosample":"K562","ontologyCurie":"EFO:0002067","strand":".","score":0.02041,"quantile":null},{"name":"POLYADENYLATION:epithelial cell of umbilical artery","modality":"POLYADENYLATION","biosample":"epithelial cell of umbilical artery","ontologyCurie":"CL:0010002","strand":".","score":0.01883,"quantile":null},{"name":"ATAC:MCF-7","modality":"ATAC","biosample":"MCF-7","ontologyCurie":"EFO:0001203","strand":".","score":-0.01882,"quantile":null},{"name":"ATAC:PC-3","modality":"ATAC","biosample":"PC-3","ontologyCurie":"EFO:0002074","strand":".","score":-0.01856,"quantile":null},{"name":"DNASE:upper lobe of left lung","modality":"DNASE","biosample":"upper lobe of left lung","ontologyCurie":"UBERON:0008952","strand":".","score":-0.0179,"quantile":null},{"name":"DNASE:brain","modality":"DNASE","biosample":"brain","ontologyCurie":"UBERON:0000955","strand":".","score":-0.01766,"quantile":null},{"name":"PROCAP:K562","modality":"PROCAP","biosample":"K562","ontologyCurie":"EFO:0002067","strand":".","score":0.01745,"quantile":null},{"name":"DNASE:spinal cord","modality":"DNASE","biosample":"spinal cord","ontologyCurie":"UBERON:0002240","strand":".","score":-0.01684,"quantile":null}]}