{"schemaVersion":"1.1.0","variant":{"id":"chr19-49487608-C-A","chromosome":"chr19","position":49487608,"ref":"C","alt":"A","rsid":null,"gene":"RPL13A"},"provenance":{"source":"atlas-api","clientVersion":"0.9.0","pipelineVersion":"0.1.0","queriedAt":"2026-09-11T12:36:10Z","configHash":"4cd6fb06e8bb2bed","calibrationEpoch":"quantiles>=2026-06-18,indels>=2026-07-14","scorers":["AVI_SCORE","AVI_SCORE_FEATURE_IMPORTANCE","AVI_SCORE_MODEL_FEATURES","RNA_SEQ","ATAC","DNASE","CAGE","PROCAP","CHIP_TF","CHIP_HISTONE","SPLICE_SITE_USAGE","SPLICE_JUNCTIONS","POLYADENYLATION","CONTACT_MAPS"],"hasQuantiles":true},"avi":{"phred":20.0183,"quantile":0.99004215,"baseValue":-0.043822,"rawScore":0.560447},"featureFamilies":[{"id":"regulatory","label":"Regulatorio (AlphaGenome)","expectedCount":10},{"id":"protein","label":"Proteina","expectedCount":4},{"id":"conservation","label":"Conservacion","expectedCount":2},{"id":"indel","label":"Indel","expectedCount":2}],"features":[{"id":"MERGED_SPLICING","label":"Splicing (fusionado)","family":"regulatory","contribution":0.040369,"value":0.131543},{"id":"MAX_ABS_ATAC","label":"ATAC","family":"regulatory","contribution":0.002892,"value":0.048729},{"id":"MAX_ABS_CONTACT_MAPS","label":"Mapas de contacto","family":"regulatory","contribution":0.002066,"value":0.001793},{"id":"MAX_ABS_DNASE","label":"DNase","family":"regulatory","contribution":0.002439,"value":0.043502},{"id":"MAX_ABS_CHIP_TF","label":"ChIP-TF","family":"regulatory","contribution":-0.000329,"value":0.108977},{"id":"MAX_ABS_CHIP_HISTONE","label":"ChIP-histonas","family":"regulatory","contribution":0.003047,"value":0.038321},{"id":"MAX_ABS_CAGE","label":"CAGE","family":"regulatory","contribution":0.013908,"value":0.262346},{"id":"MAX_ABS_PROCAP","label":"PRO-cap","family":"regulatory","contribution":0.024109,"value":0.318491},{"id":"MAX_ABS_RNA_SEQ","label":"RNA-seq","family":"regulatory","contribution":0.008429,"value":0.076684},{"id":"MAX_ABS_POLYADENYLATION","label":"Poliadenilacion","family":"regulatory","contribution":0.005991,"value":0.061265},{"id":"ALPHAMISSENSE","label":"AlphaMissense","family":"protein","contribution":0.0,"value":null},{"id":"CACTUS_241_WAY","label":"phyloP Cactus 241-way","family":"conservation","contribution":0.357013,"value":5.953},{"id":"PROTEIN_TERMINATION","label":"Terminacion de proteina","family":"protein","contribution":0.0,"value":0.0},{"id":"START_LOST","label":"Inicio perdido","family":"protein","contribution":0.0,"value":0.0},{"id":"STOP_LOST","label":"Stop perdido","family":"protein","contribution":0.0,"value":0.0},{"id":"PHASTCONS_470_WAY","label":"PhastCons 470-way","family":"conservation","contribution":0.144334,"value":1.0},{"id":"IS_INSERTION","label":"Es insercion","family":"indel","contribution":0.0,"value":0.0},{"id":"IS_DELETION","label":"Es delecion","family":"indel","contribution":0.0,"value":0.0}],"topTracks":[{"name":"SPLICE_JUNCTIONS:WTC11","modality":"SPLICE_JUNCTIONS","biosample":"WTC11","ontologyCurie":"EFO:0009747","strand":".","score":0.34741,"quantile":null},{"name":"SPLICE_JUNCTIONS:H9","modality":"SPLICE_JUNCTIONS","biosample":"H9","ontologyCurie":"EFO:0003045","strand":".","score":0.3457,"quantile":null},{"name":"SPLICE_JUNCTIONS:mesendoderm","modality":"SPLICE_JUNCTIONS","biosample":"mesendoderm","ontologyCurie":"NTR:0000856","strand":".","score":0.34375,"quantile":null},{"name":"PROCAP:Calu3","modality":"PROCAP","biosample":"Calu3","ontologyCurie":"EFO:0002819","strand":".","score":0.31849,"quantile":null},{"name":"PROCAP:Caco-2","modality":"PROCAP","biosample":"Caco-2","ontologyCurie":"EFO:0001099","strand":".","score":0.3135,"quantile":null},{"name":"PROCAP:endothelial cell of umbilical vein","modality":"PROCAP","biosample":"endothelial cell of umbilical vein","ontologyCurie":"CL:0002618","strand":".","score":0.30476,"quantile":null},{"name":"CAGE:saliva-secreting gland","modality":"CAGE","biosample":"saliva-secreting gland","ontologyCurie":"UBERON:0001044","strand":".","score":-0.26235,"quantile":null},{"name":"CAGE:adipocyte of omentum tissue","modality":"CAGE","biosample":"adipocyte of omentum tissue","ontologyCurie":"CL:0002615","strand":".","score":-0.25257,"quantile":null},{"name":"CAGE:pancreas","modality":"CAGE","biosample":"pancreas","ontologyCurie":"UBERON:0001264","strand":".","score":-0.25206,"quantile":null},{"name":"CHIP_TF:HeLa-S3","modality":"CHIP_TF","biosample":"HeLa-S3","ontologyCurie":"EFO:0002791","strand":".","score":0.10898,"quantile":null},{"name":"CHIP_TF:GM12891","modality":"CHIP_TF","biosample":"GM12891","ontologyCurie":"EFO:0002785","strand":".","score":0.07102,"quantile":null},{"name":"CHIP_TF:HEK293","modality":"CHIP_TF","biosample":"HEK293","ontologyCurie":"EFO:0001182","strand":".","score":-0.07078,"quantile":null},{"name":"POLYADENYLATION:fibroblast of skin of back","modality":"POLYADENYLATION","biosample":"fibroblast of skin of back","ontologyCurie":"CL:0011022","strand":".","score":0.06051,"quantile":null},{"name":"POLYADENYLATION:fibroblast of skin of scalp","modality":"POLYADENYLATION","biosample":"fibroblast of skin of scalp","ontologyCurie":"NTR:0000524","strand":".","score":0.05424,"quantile":null},{"name":"ATAC:DND-41","modality":"ATAC","biosample":"DND-41","ontologyCurie":"EFO:0007074","strand":".","score":-0.04873,"quantile":null},{"name":"POLYADENYLATION:right renal pelvis","modality":"POLYADENYLATION","biosample":"right renal pelvis","ontologyCurie":"UBERON:0018116","strand":".","score":0.04852,"quantile":null},{"name":"ATAC:GM23338","modality":"ATAC","biosample":"GM23338","ontologyCurie":"EFO:0007950","strand":".","score":-0.04505,"quantile":null},{"name":"DNASE:Caki2","modality":"DNASE","biosample":"Caki2","ontologyCurie":"EFO:0002150","strand":".","score":-0.0435,"quantile":null},{"name":"ATAC:WTC11","modality":"ATAC","biosample":"WTC11","ontologyCurie":"EFO:0009747","strand":".","score":-0.04321,"quantile":null},{"name":"CHIP_HISTONE:SU-DHL-6","modality":"CHIP_HISTONE","biosample":"SU-DHL-6","ontologyCurie":"EFO:0002357","strand":".","score":0.03832,"quantile":null}]}