{"schemaVersion":"1.1.0","variant":{"id":"chr4-81735000-C-A","chromosome":"chr4","position":81735000,"ref":"C","alt":"A","rsid":null,"gene":"RASGEF1B"},"provenance":{"source":"atlas-api","clientVersion":"0.9.0","pipelineVersion":"0.1.0","queriedAt":"2026-09-11T12:18:18Z","configHash":"db3b92963bb4600a","calibrationEpoch":"quantiles>=2026-06-18,indels>=2026-07-14","scorers":["AVI_SCORE","AVI_SCORE_FEATURE_IMPORTANCE","AVI_SCORE_MODEL_FEATURES","RNA_SEQ","ATAC","DNASE","CAGE","PROCAP","CHIP_TF","CHIP_HISTONE","SPLICE_SITE_USAGE","SPLICE_JUNCTIONS","POLYADENYLATION","CONTACT_MAPS"],"hasQuantiles":true},"avi":{"phred":2.3,"quantile":0.41115767,"baseValue":-0.04903,"rawScore":-0.010683},"featureFamilies":[{"id":"regulatory","label":"Regulatorio (AlphaGenome)","expectedCount":10},{"id":"protein","label":"Proteina","expectedCount":4},{"id":"conservation","label":"Conservacion","expectedCount":2},{"id":"indel","label":"Indel","expectedCount":2}],"features":[{"id":"MERGED_SPLICING","label":"Splicing (fusionado)","family":"regulatory","contribution":0.006746,"value":0.022729},{"id":"MAX_ABS_ATAC","label":"ATAC","family":"regulatory","contribution":0.001445,"value":0.022198},{"id":"MAX_ABS_CONTACT_MAPS","label":"Mapas de contacto","family":"regulatory","contribution":0.000858,"value":0.000759},{"id":"MAX_ABS_DNASE","label":"DNase","family":"regulatory","contribution":0.003114,"value":0.039854},{"id":"MAX_ABS_CHIP_TF","label":"ChIP-TF","family":"regulatory","contribution":0.00057,"value":0.093285},{"id":"MAX_ABS_CHIP_HISTONE","label":"ChIP-histonas","family":"regulatory","contribution":0.001741,"value":0.019153},{"id":"MAX_ABS_CAGE","label":"CAGE","family":"regulatory","contribution":0.001395,"value":0.029464},{"id":"MAX_ABS_PROCAP","label":"PRO-cap","family":"regulatory","contribution":0.000563,"value":0.006838},{"id":"MAX_ABS_RNA_SEQ","label":"RNA-seq","family":"regulatory","contribution":0.000934,"value":0.009602},{"id":"MAX_ABS_POLYADENYLATION","label":"Poliadenilacion","family":"regulatory","contribution":0.001907,"value":0.019371},{"id":"ALPHAMISSENSE","label":"AlphaMissense","family":"protein","contribution":0.0,"value":null},{"id":"CACTUS_241_WAY","label":"phyloP Cactus 241-way","family":"conservation","contribution":0.019073,"value":0.309},{"id":"PROTEIN_TERMINATION","label":"Terminacion de proteina","family":"protein","contribution":0.0,"value":0.0},{"id":"START_LOST","label":"Inicio perdido","family":"protein","contribution":0.0,"value":0.0},{"id":"STOP_LOST","label":"Stop perdido","family":"protein","contribution":0.0,"value":0.0},{"id":"PHASTCONS_470_WAY","label":"PhastCons 470-way","family":"conservation","contribution":0.0,"value":0.0},{"id":"IS_INSERTION","label":"Es insercion","family":"indel","contribution":0.0,"value":0.0},{"id":"IS_DELETION","label":"Es delecion","family":"indel","contribution":0.0,"value":0.0}],"topTracks":[{"name":"CHIP_TF:mammary epithelial cell","modality":"CHIP_TF","biosample":"mammary epithelial cell","ontologyCurie":"CL:0002327","strand":".","score":-0.09328,"quantile":null},{"name":"CHIP_TF:K562","modality":"CHIP_TF","biosample":"K562","ontologyCurie":"EFO:0002067","strand":".","score":-0.05432,"quantile":null},{"name":"CHIP_TF:HeLa-S3","modality":"CHIP_TF","biosample":"HeLa-S3","ontologyCurie":"EFO:0002791","strand":".","score":-0.04788,"quantile":null},{"name":"DNASE:foreskin keratinocyte","modality":"DNASE","biosample":"foreskin keratinocyte","ontologyCurie":"CL:1001606","strand":".","score":-0.03985,"quantile":null},{"name":"DNASE:trophoblast cell","modality":"DNASE","biosample":"trophoblast cell","ontologyCurie":"CL:0000351","strand":".","score":-0.03895,"quantile":null},{"name":"DNASE:hindlimb muscle","modality":"DNASE","biosample":"hindlimb muscle","ontologyCurie":"UBERON:0003663","strand":".","score":-0.03714,"quantile":null},{"name":"SPLICE_JUNCTIONS:mammary stem cell","modality":"SPLICE_JUNCTIONS","biosample":"mammary stem cell","ontologyCurie":"CL:0002451","strand":".","score":0.03387,"quantile":null},{"name":"SPLICE_JUNCTIONS:ectodermal cell","modality":"SPLICE_JUNCTIONS","biosample":"ectodermal cell","ontologyCurie":"CL:0000221","strand":".","score":0.03296,"quantile":null},{"name":"SPLICE_JUNCTIONS:neurosphere","modality":"SPLICE_JUNCTIONS","biosample":"neurosphere","ontologyCurie":"NTR:0000427","strand":".","score":0.03223,"quantile":null},{"name":"CAGE:epithelial cell of esophagus","modality":"CAGE","biosample":"epithelial cell of esophagus","ontologyCurie":"CL:0002252","strand":".","score":0.02946,"quantile":null},{"name":"CAGE:cerebellum","modality":"CAGE","biosample":"cerebellum","ontologyCurie":"UBERON:0002037","strand":".","score":0.02312,"quantile":null},{"name":"CAGE:umbilical cord","modality":"CAGE","biosample":"umbilical cord","ontologyCurie":"UBERON:0002331","strand":".","score":0.0224,"quantile":null},{"name":"ATAC:HG02759","modality":"ATAC","biosample":"HG02759","ontologyCurie":"EFO:0010847","strand":".","score":-0.0222,"quantile":null},{"name":"ATAC:GM19397","modality":"ATAC","biosample":"GM19397","ontologyCurie":"CLO:0026782","strand":".","score":-0.01953,"quantile":null},{"name":"CHIP_HISTONE:mesenchymal stem cell","modality":"CHIP_HISTONE","biosample":"mesenchymal stem cell","ontologyCurie":"CL:0000134","strand":".","score":-0.01915,"quantile":null},{"name":"ATAC:GM19463","modality":"ATAC","biosample":"GM19463","ontologyCurie":"CLO:0026874","strand":".","score":-0.01896,"quantile":null},{"name":"CHIP_HISTONE:temporal lobe","modality":"CHIP_HISTONE","biosample":"temporal lobe","ontologyCurie":"UBERON:0001871","strand":".","score":-0.01887,"quantile":null},{"name":"CHIP_HISTONE:HepG2","modality":"CHIP_HISTONE","biosample":"HepG2","ontologyCurie":"EFO:0001187","strand":".","score":-0.01858,"quantile":null},{"name":"POLYADENYLATION:fibroblast derived cell line","modality":"POLYADENYLATION","biosample":"fibroblast derived cell line","ontologyCurie":"EFO:0002009","strand":".","score":0.01076,"quantile":null},{"name":"POLYADENYLATION:IMR-90","modality":"POLYADENYLATION","biosample":"IMR-90","ontologyCurie":"EFO:0001196","strand":".","score":0.01045,"quantile":null}]}